class_name,teacher,school_name,student_num
对神经网络对抗鲁棒性正则化的认识,温宇馨 ,华南理工大学,67
Brain Science and Advanced Imaging Techniques,张明 ,西安交通大学,65
度量和改进图信息在图神经网络中的使用,侯逸帆 ,香港中文大学,65
Engineering Responsible AI,沈向洋 ,清华大学,63
计算机组织与结构,赖晓晨 王洁 迟宗正 ,大连理工大学,60
不止于准确性：使用CheckList为NLP模型的进行行为测试,吴彤霜 ,华盛顿大学,59
细粒度实体分类综述,金海龙 ,清华大学,57
Introduction of Artificial Intelligence,莫宏伟 ,哈尔滨工程大学,57
基于神经隐变量模型的对话状态推理,闵庆凯 ,南京航空航天大学,57
北京邮电大学人工智能能力认证证书项目（002期）,李蕾 杨亚 李睿凡 周延泉 袁宝库 ,北京邮电大学,56
结合词典的中文命名实体识别,李孝男 ,复旦大学,54
TIMME: Twitter Ideology-detection via Multi-task Multi-relational Embedding,肖之屏 ,加州大学洛杉矶分校,53
Java Object Oriented Programming,单博炜 ,长安大学,53
WWW 2020 | 探索资源约束的Contextual Bandits问题,李卿阳 唐小程 ,学堂在线计算机学院,47
神经机器翻译中的曝光偏差，幻觉翻译与跨域稳定性,王朝君 ,爱丁堡大学,43
轮式机器人入门,索毅 ,学堂在线,39
多领域端到端任务型对话系统研究分享,覃立波 ,哈尔滨工业大学,34
探究句法信息对于基于句法距离的语言模型影响,杜文宇 ,西湖大学,31
MySQL Database Programming,付湘琼 赵晓侠 杜文方 郝熙 刘领兵 潘晟旻 郑发鸿 寇卫利 李菊芳 张春红 张俊 张霖 马晓静 ,昆明理工大学,26
计算机辅助绘图——Solid Edge ST,李世芸 ,昆明理工大学,22
深度学习训练营（测试）,胡晓林 ,清华大学,19
Ship,孙建平 姜忻 ,大连海事大学,12
机器学习训练营第2期,张敏 ,学堂在线计算机学院,9
自然语言处理训练营,刘知远 ,学堂在线计算机学院,8
推荐系统训练营（第2期）,张敏 ,学堂在线计算机学院,5
深度学习训练营,胡晓林 ,学堂在线计算机学院,5
大学计算机基础（艺术类）,史家银 杜文博 朱原良 ,云南艺术学院,2
数据科学认证证书项目（2020年4期）,袁博 王智 袁春 何隽 何隽 ,清华大学,2
青少年编程能力培养计划,郑莉 徐明星 邬晓钧 陈永强 ,清华大学,2
深度学习原理与PyTorch实战,张江 ,集智学园,2
